{
  "contract_version": "0.0.0",
  "test_only": true,
  "execution_id": "synthetic-execution-indeterminate",
  "request_id": "synthetic-request-indeterminate",
  "generated_at": "2026-01-15T12:00:01Z",
  "computational_status": "indeterminate",
  "governance": {
    "contract_version": "0.0.0",
    "test_only": true,
    "artifact_status": "draft",
    "declared_deployment_class": "A_RESEARCH_CORE",
    "derived_minimum_deployment_class": "A_RESEARCH_CORE",
    "effective_deployment_class": "A_RESEARCH_CORE",
    "disclaimer_version": "2026-08-08",
    "regulatory_use_context": {"contract_version": "0.0.0", "declared_deployment_class": "A_RESEARCH_CORE", "derived_minimum_deployment_class": "A_RESEARCH_CORE", "effective_deployment_class": "A_RESEARCH_CORE", "operator_legal_entity": "not_applicable", "operator_jurisdiction": "not_applicable", "authorization_type": "not_applicable", "authorization_registry_id": "not_applicable", "client_specific": false, "instrument_scope": "cashflow_only", "alternatives_origin": "user_supplied", "ranking_enabled": false, "recommendation_language_enabled": false, "execution_enabled": false, "compensation_model": "none", "conflict_policy_id": "not_applicable", "suitability_record_id": "not_applicable", "human_reviewer_id": "not_applicable", "counsel_opinion_id": "not_applicable", "retention_policy_id": "not_applicable"},
    "intended_uses": ["contract_validation"],
    "prohibited_uses": ["individualized_recommendation", "order_execution", "benefit_guarantee", "tax_or_legal_determination"],
    "model_use_status": "research_only",
    "policy_status": "unknown",
    "data_quality_status": "synthetic_only",
    "data_license_status": "no_external_data",
    "regulatory_use_status": "indeterminate",
    "reproducibility_class": "exact",
    "model_card": {"artifact_id": "model-card", "applicability": "not_applicable"},
    "policy_pack": {"artifact_id": "policy-pack", "applicability": "unknown"},
    "data_snapshot": {"artifact_id": "data-snapshot", "applicability": "not_applicable"},
    "authority_refs": [],
    "governance_reason_codes": ["LEGAL_STATUS_UNKNOWN"],
    "human_review": {"required": false, "completed": false, "reviewer_id": null, "reviewed_at": null}
  },
  "diagnostics": [{
    "code": "LEGAL_STATUS_UNKNOWN",
    "category": "policy",
    "severity": "error",
    "computational_status": "indeterminate",
    "message_template_id": "legal-status-unknown",
    "json_pointer": "/governance/policy_status",
    "retryable": false,
    "remediation_id": "resolve-legal-status",
    "authority_refs": [],
    "model_refs": [],
    "safe_context": {}
  }],
  "result": null,
  "run_manifest": {
    "canonicalization": "RFC8785",
    "manifest_privacy_class": "public_non_personal",
    "linkability_scope": "none",
    "input_reference": {"strategy": "none"},
    "software_artifact": {"artifact_id": "runtime-software", "version": "0.0.0", "sha256": "1111111111111111111111111111111111111111111111111111111111111111"},
    "contract_schema": {"artifact_id": "execution-envelope-schema", "version": "0.0.0", "sha256": "2222222222222222222222222222222222222222222222222222222222222222"},
    "runtime": {"runtime_id": "fixture-validator", "runtime_version": "0.0.0", "platform": "synthetic", "decimal_context": null, "rng": null, "solver": null}
  }
}
